{
  "protocol": {
    "name": "mparser.performance-baseline",
    "major": 1,
    "minor": 0
  },
  "generated_at_utc": "2026-08-02T04:47:57Z",
  "revision": "3ec2bc074387283785068fe6ac98b4472a109a3a",
  "environment": {
    "os": "Linux",
    "os_version": "6.17.0-1020-azure",
    "architecture": "aarch64",
    "cpu_model": "ARM (implementer=0x41, architecture=8, variant=0x0, part=0xd49, revision=0)",
    "logical_cpu_count": 4,
    "physical_memory_bytes": 16722042880,
    "emulated": false
  },
  "build": {
    "project_version": "0.90.0",
    "build_type": "Release",
    "compiler_id": "GNU",
    "compiler_version": "13.3.0",
    "native_jit_available": true,
    "native_jit_platform": "ARM-64 64bit (little endian + unaligned)"
  },
  "workload": {
    "id": "scalar-loop-v1",
    "source_path": "/home/runner/work/MParser/MParser/samples/performance_scalar_loop.m",
    "source_sha256": "42e592b7a89fa2c0184386d99c5f1409776eaaaacf07948ce4ac31aadbece9c6",
    "source_bytes": 159,
    "source_lines": 9,
    "result_variable": "baseline_result"
  },
  "settings": {
    "parse_warmup": 3,
    "parse_iterations": 20,
    "compile_warmup": 2,
    "compile_iterations": 10,
    "runtime_warmup": 3,
    "runtime_iterations": 20,
    "process_iterations": 5
  },
  "measurements": {
    "parse": {
      "status": "measured",
      "reason": "",
      "boundary": "Lexer construction through Parser::parse return; in-memory source, syntax destruction excluded",
      "warmup_iterations": 3,
      "measured_iterations": 20,
      "host_wall": {
        "unit": "nanoseconds",
        "samples_ns": [
          16721,
          15504,
          16697,
          15624,
          15505,
          15176,
          15457,
          15112,
          14992,
          15065,
          15112,
          14921,
          14968,
          14993,
          14864,
          14769,
          14896,
          14801,
          14880,
          14657
        ],
        "total_ns": 304714,
        "mean_ns": 15235.7,
        "median_ns": 15029.0,
        "minimum_ns": 14657,
        "p95_ns": 16697,
        "maximum_ns": 16721
      },
      "engine_elapsed": null,
      "allocation_activity": {
        "aggregation": "sum-across-measured-iterations",
        "successful_request_count": 4940,
        "requested_bytes": 1150580,
        "successful_request_samples": [
          247,
          247,
          247,
          247,
          247,
          247,
          247,
          247,
          247,
          247,
          247,
          247,
          247,
          247,
          247,
          247,
          247,
          247,
          247,
          247
        ],
        "requested_byte_samples": [
          57529,
          57529,
          57529,
          57529,
          57529,
          57529,
          57529,
          57529,
          57529,
          57529,
          57529,
          57529,
          57529,
          57529,
          57529,
          57529,
          57529,
          57529,
          57529,
          57529
        ],
        "boundary": "successful global operator new/new[] requests in the baseline process for each measured call; totals sum all measured iterations, while deallocation and child-process allocations are excluded"
      },
      "execution_summary": null
    },
    "compile": {
      "status": "measured",
      "reason": "",
      "boundary": "collector compile wrapper entry through immutable CompiledModule return; includes source ownership copy into CompiledModule::compile, while module destruction and source file I/O are excluded",
      "warmup_iterations": 2,
      "measured_iterations": 10,
      "host_wall": {
        "unit": "nanoseconds",
        "samples_ns": [
          88275,
          62618,
          60730,
          59346,
          59354,
          60898,
          58546,
          58794,
          57882,
          57554
        ],
        "total_ns": 623997,
        "mean_ns": 62399.7,
        "median_ns": 59350.0,
        "minimum_ns": 57554,
        "p95_ns": 88275,
        "maximum_ns": 88275
      },
      "engine_elapsed": null,
      "allocation_activity": {
        "aggregation": "sum-across-measured-iterations",
        "successful_request_count": 10170,
        "requested_bytes": 1483380,
        "successful_request_samples": [
          1017,
          1017,
          1017,
          1017,
          1017,
          1017,
          1017,
          1017,
          1017,
          1017
        ],
        "requested_byte_samples": [
          148338,
          148338,
          148338,
          148338,
          148338,
          148338,
          148338,
          148338,
          148338,
          148338
        ],
        "boundary": "successful global operator new/new[] requests in the baseline process for each measured call; totals sum all measured iterations, while deallocation and child-process allocations are excluded"
      },
      "execution_summary": null
    },
    "process_cold_start": {
      "status": "measured",
      "reason": "",
      "boundary": "fresh child process launch request through child exit; includes CLI startup, source file I/O, compile, one --run --jit=off execution, and shutdown; child output discarded",
      "warmup_iterations": 0,
      "measured_iterations": 5,
      "host_wall": {
        "unit": "nanoseconds",
        "samples_ns": [
          835989644,
          837065593,
          837366019,
          832184148,
          835692969
        ],
        "total_ns": 4178298373,
        "mean_ns": 835659674.6,
        "median_ns": 835989644.0,
        "minimum_ns": 832184148,
        "p95_ns": 837366019,
        "maximum_ns": 837366019
      },
      "engine_elapsed": null,
      "allocation_activity": null,
      "execution_summary": null
    },
    "bytecode": {
      "status": "measured",
      "reason": "",
      "boundary": "CompiledModule::execute(Bytecode) call entry through projected ModuleInvocationResult return; compile and result destruction excluded",
      "warmup_iterations": 3,
      "measured_iterations": 20,
      "host_wall": {
        "unit": "nanoseconds",
        "samples_ns": [
          827026444,
          826640151,
          827497051,
          827512708,
          826960490,
          825913807,
          826403550,
          828626706,
          827559632,
          826637242,
          826318792,
          826682580,
          827407395,
          827024654,
          827735509,
          827568016,
          825421150,
          828104657,
          827987943,
          826057281
        ],
        "total_ns": 16541085758,
        "mean_ns": 827054287.9,
        "median_ns": 827025549.0,
        "minimum_ns": 825421150,
        "p95_ns": 828104657,
        "maximum_ns": 828626706
      },
      "engine_elapsed": {
        "unit": "nanoseconds",
        "samples_ns": [
          827017972,
          826631711,
          827488787,
          827508932,
          826951698,
          825906127,
          826393902,
          828618746,
          827551600,
          826634154,
          826312328,
          826674676,
          827397363,
          827015862,
          827726093,
          827563992,
          825414589,
          828096441,
          827980070,
          826049073
        ],
        "total_ns": 16540934116,
        "mean_ns": 827046705.8,
        "median_ns": 827016917.0,
        "minimum_ns": 825414589,
        "p95_ns": 828096441,
        "maximum_ns": 828618746
      },
      "allocation_activity": {
        "aggregation": "sum-across-measured-iterations",
        "successful_request_count": 138061300,
        "requested_bytes": 8963475840,
        "successful_request_samples": [
          6903065,
          6903065,
          6903065,
          6903065,
          6903065,
          6903065,
          6903065,
          6903065,
          6903065,
          6903065,
          6903065,
          6903065,
          6903065,
          6903065,
          6903065,
          6903065,
          6903065,
          6903065,
          6903065,
          6903065
        ],
        "requested_byte_samples": [
          448173792,
          448173792,
          448173792,
          448173792,
          448173792,
          448173792,
          448173792,
          448173792,
          448173792,
          448173792,
          448173792,
          448173792,
          448173792,
          448173792,
          448173792,
          448173792,
          448173792,
          448173792,
          448173792,
          448173792
        ],
        "boundary": "successful global operator new/new[] requests in the baseline process for each measured call; totals sum all measured iterations, while deallocation and child-process allocations are excluded"
      },
      "execution_summary": {
        "effective_tiers": [
          "bytecode"
        ],
        "fallback_iterations": 0,
        "executed_instruction_count": 38010120,
        "typed_region_count": 0,
        "typed_region_attempt_count": 0,
        "typed_region_execution_count": 0,
        "typed_region_fallback_count": 0,
        "native_compilation_count": 0,
        "native_cache_hit_count": 0,
        "maximum_call_depth": 0,
        "maximum_array_bytes": 0,
        "maximum_diagnostic_count": 0
      }
    },
    "portable": {
      "status": "measured",
      "reason": "",
      "boundary": "CompiledModule::execute(Portable) call entry through projected ModuleInvocationResult return; static typed planning and compile excluded",
      "warmup_iterations": 3,
      "measured_iterations": 20,
      "host_wall": {
        "unit": "nanoseconds",
        "samples_ns": [
          5694085,
          5700341,
          5701565,
          5707638,
          5693453,
          5686821,
          5707165,
          5714782,
          5685477,
          5692422,
          5693781,
          5714982,
          5691821,
          5685293,